{
  "specversion": "1.0",
  "id": "44444444-4444-4444-8444-444444444444",
  "source": "https://omama.vn/services/order-service",
  "type": "vn.omama.order.manual_refund_verified.v1",
  "subject": "refund:11111111-1111-4111-8111-111111111111",
  "time": "2026-10-15T15:00:00Z",
  "datacontenttype": "application/json",
  "data": {
    "refund_id": "11111111-1111-4111-8111-111111111111",
    "receipt_id": "22222222-2222-4222-8222-222222222222",
    "order_id": "33333333-3333-4333-8333-333333333333",
    "amount": 225000,
    "currency": "VND",
    "execution_mode": "MANUAL_BANK_TRANSFER",
    "evidence_hash": "aaaaaaaaaaaaaaaaaaaaaaaaaaaaaaaaaaaaaaaaaaaaaaaaaaaaaaaaaaaaaaaa",
    "status": "SUCCEEDED"
  }
}
